{
  "$id": "https://gpu-simulator.local/schemas/sm86_c7_sol_l1p035_vertical_v1.schema.json",
  "$schema": "https://json-schema.org/draft/2020-12/schema",
  "additionalProperties": false,
  "properties": {
    "candidate":{"type":"string"},"correctness_and_sanitizer":{"additionalProperties":true,"type":"object"},"crosswalk":{"additionalProperties":true,"type":"object"},"identity":{"additionalProperties":true,"type":"object"},"interpretation":{"minLength":1,"type":"string"},"ncu":{"additionalProperties":true,"type":"object"},"nvbit":{"additionalProperties":true,"type":"object"},"phase":{"const":"C7-S34AD"},"schema":{"const":"sm86_c7_sol_l1p035_vertical_v1"},"simulator":{"additionalProperties":true,"type":"object"},"status":{"type":"string"}
  },
  "required":["schema","status","phase","candidate","identity","correctness_and_sanitizer","nvbit","simulator","ncu","crosswalk","interpretation"],"title":"SM86 C7-S34AD L1 problem035 vertical","type":"object"
}
